Interpret;Titel
The Juan Maclean;Toto´s Way
Six. By Seven;You Know I Feel Alright Now
Jürgen Pape;Cream
Border Crossing;Taxi
Volaga Select;Les Annees Des Plomb (Joshua Rmx)
The Five Corners Quintet feat. Mark Murphy;This Could Be The Start Of Something
Four Tet;Sun Drums And Soil
Ebe;Busted
Varano feat. Diane Charlemagne;Music Is My Soul
Cyantific feat. Diane Charlemagne;Don´t Follow
Van der Graaf Generator;Theme One
Pendulum;Out There
Infusion;The Careless Kind (Evil Nine Remix)
Windsor For The Derby;Praise
Erlend Oye & Band;Cool My Fire
Gorillaz feat. Shaun Ryder;Dare (DFA Remix)
Six. By seven;Tonight
Marco Do Santos;Not On The Guest List
Aril Brikha;Dissorganised
Recloose feat. Joe Dukie;Dust
Trickski feat. MC Kokotrunk;Sweat
Psychedelic Furs;Heartbeat
Bloc Party;Price Of Gasoline (Automato Rmx)
Uncut;Understanding The New Violence
Aswefall;Take Me With You
VHS Or Beta;Night On Fire (Carlos D Rmx)
Volga Select;Transe
